{
  "$schema": "../schemas/battle-bundle.schema.json",
  "seed": 123,
  "maxFrames": 1000,
  "battle": {
    "attributeIds": [
      "max_hp",
      "physical_defense",
      "magical_defense",
      "crit_rate",
      "crit_damage",
      "damage_dealt",
      "damage_taken",
      "move_speed",
      "attack"
    ],
    "bindings": {
      "maxHp": "max_hp",
      "physicalDefense": "physical_defense",
      "magicalDefense": "magical_defense",
      "critRate": "crit_rate",
      "critDamage": "crit_damage",
      "damageDealt": "damage_dealt",
      "damageTaken": "damage_taken",
      "moveSpeed": "move_speed"
    },
    "resources": [{ "id": "mana", "maximum": 100 }],
    "brains": [
      {
        "id": "chase",
        "kind": "ChaseAttack",
        "aggroRadius": 12,
        "attackRange": 8,
        "leashRadius": 14
      }
    ],
    "skills": [
      {
        "id": "strike",
        "durationFrames": 1,
        "cooldownFrames": 15,
        "range": 8,
        "effects": [
          {
            "kind": "damage",
            "frame": 0,
            "target": { "kind": "CurrentTarget", "relation": "Enemies" },
            "damageType": "Physical",
            "flat": 0,
            "attributeId": "attack",
            "ratio": 10000,
            "canCrit": true
          }
        ]
      }
    ],
    "buffs": [
      {
        "id": "save",
        "durationFrames": 0,
        "stackingRule": "Unique",
        "effects": [
          {
            "kind": "combatTrigger",
            "trigger": "TakeDamage",
            "actions": [
              { "kind": "heal", "target": "Owner", "flat": 10 }
            ]
          }
        ]
      }
    ],
    "characterTemplates": [
      {
        "id": "hero",
        "radius": { "n": 1, "d": 2 },
        "skillIds": ["strike"],
        "baseAttributes": {
          "max_hp": 100,
          "physical_defense": 0,
          "magical_defense": 0,
          "crit_rate": 0,
          "crit_damage": 15000,
          "damage_dealt": 0,
          "damage_taken": 0,
          "move_speed": 3,
          "attack": 20
        }
      },
      {
        "id": "goblin",
        "radius": { "n": 1, "d": 2 },
        "brainId": "chase",
        "skillIds": ["strike"],
        "baseAttributes": {
          "max_hp": 40,
          "physical_defense": 0,
          "magical_defense": 0,
          "crit_rate": 0,
          "crit_damage": 15000,
          "damage_dealt": 0,
          "damage_taken": 0,
          "move_speed": 3,
          "attack": 8
        }
      }
    ]
  },
  "map": {
    "bounds": {
      "min": { "x": 0, "y": 0 },
      "max": { "x": 20, "y": 20 }
    },
    "terrain": [
      {
        "min": { "x": 10, "y": 0 },
        "max": { "x": 11, "y": 4 }
      }
    ],
    "playerSpawnMarkers": [
      { "id": "player", "position": { "x": 2, "y": 2 } }
    ],
    "spawnPoints": [
      { "id": "gate", "position": { "x": 8, "y": 2 }, "tableEntryId": "wave" }
    ]
  },
  "spawnTable": {
    "entries": [
      {
        "id": "wave",
        "templateId": "goblin",
        "factionId": 2,
        "frame": 2,
        "count": 1
      }
    ]
  }
}
